{
  "id": "a2b3c4d5-e6f7-4789-a012-3456789abcde",
  "name": "B2B Sales",
  "description": "Outbound pipeline for enterprise cybersecurity contracts.",
  "company_id": "a1b2c3d4-e5f6-4789-a012-3456789abcde",
  "brand_id": null,
  "squad_id": "e1f2a3b4-c5d6-4789-e012-3456789abcde",
  "manager_id": "c1d2e3f4-a5b6-4789-c012-3456789abcde",
  "kanban_stages": ["Prospect", "Qualified", "Proposal Sent", "In Negotiation", "Won"],
  "state": "active",
  "proposed_on": "2025-02-10",
  "activated_on": "2025-03-01",
  "paused_on": null,
  "retired_on": null,
  "created_at": "2025-02-10T09:00:00Z",
  "updated_at": "2026-04-19T10:00:00Z"
}
